originalPlace,interpretedPlace,longitude,latitude,xmin,xmax,ymin,ymax,uncertainty
"USA. Kansas. Atchison County. Atchison. On highway near the Kereford Quarry, 2 mi S of Atchison.","Atchison, Shannon Township, Atchison County, Kansas, United States",-95.1216356,39.5630521,-95.251259,-95.096904,39.527728,39.594701,4106
"USA. Nebraska. Johnson County. Elk Creek. 2.5 miles NW of Elk Creek, just E of RR crossing.","Elk Creek, Todd Creek Precinct, Johnson County, Nebraska, United States, 68348",-96.129451,40.2858334,-96.1328599,-96.122674,40.2842719,40.2914839,338
"USA, Nebraska, Cass County, Nehawka, Van Court Quarry","Nehawka, Nehawka Precinct, Cass County, Nebraska, United States, 68413",-95.9915664,40.8303487,-95.997762,-95.9834449,40.824676,40.834061,800
USA. Nebraska. Saunders County. 2.5 mi S  4 mi E of Ashland.,"Ashland, Ashland Township, Saunders County, Nebraska, United States, 68003",-96.3683157,41.0393413,-96.392216,-96.352164,41.027243,41.048736,1713
USA. Missouri. Platte County. E Leavenworth. 0.5 mi S of E Leavenworth.,"Platte County, Missouri, United States",-94.7691586,39.3475649,-95.1028878,-94.600347,39.1537071,39.533347,25232
"USA. Missouri. Jackson County. North of Kansas City, along Cliff Drive.","Cliff Drive, Northeast Kansas City, Kansas City, Jackson County, Missouri, United States",-94.5451558,39.1155885,-94.5624426,-94.5276366,39.1100392,39.1212306,1617
"USA. Kansas. Riley County. Pawnee. Pawnee Creek, 3.5 mi N  1.25 mi W of Pawnee.","Pawnee Creek, Bourbon County, Kansas, United States, 66701",-94.85726893,37.73525021,-94.9039424,-94.8105955,37.6752141,37.7952863,7830
USA. Michigan. Eaton County. Grand Ledge.,"Grand Ledge, Eagle Township, Eaton County, Michigan, United States, 48837",-84.7463757,42.7533685,-84.769196,-84.7197691,42.732846,42.7811971,2948
"USA, Nebraska, Cass County, Ashland, SE of Ashland","Cass County, Nebraska, United States",-96.1526985,40.8755529,-96.463861,-95.809379,40.78347,41.0660011,28169
USA. Missouri. Holt County. SE of Forest City.,"Forest City, Forest Township, Holt County, Missouri, United States",-95.1919204,39.9824969,-95.203671,-95.175327,39.976653,39.991389,1195
USA. Kansas. Wyandotte County. Forest Lake near Bonner Springs.,"Bonner Springs, Shawnee Mission, Wyandotte County, Kansas, United States",-94.8835754,39.059726,-94.917953,-94.834942,39.0361631,39.115934,3962
"USA, Nebraska, Pawnee County, Table Rock","Table Rock, 3, Table Rock, Pawnee County, Nebraska, United States, 68447",-96.0947268,40.1761111,-96.104632,-96.0733569,40.174582,40.182112,861
"USA, Kansas, Shawnee County, Topeka, 0.5 mile N of Poor Farm","Topeka, Shawnee County, Kansas, United States",-95.6751576,39.0473451,-95.812638,-95.603557,38.917194,39.1094,9265
"USA. Nebraska. Cass County. Jones Point. Late Pennsylvanian. Virgilian. Shawnee Grp. Topeka Ls. Coal Creek Mbr. Union Ls no longer used. Replaced with Coal Creek Ls bed.., Cass County","Cass County, Nebraska, United States",-96.1526985,40.8755529,-96.463861,-95.809379,40.78347,41.0660011,28169
USA. Nebraska. Cass County. NW of Nehawka.,"Nehawka, Nehawka Precinct, Cass County, Nebraska, United States, 68413",-95.9915664,40.8303487,-95.997762,-95.9834449,40.824676,40.834061,800
"USA. Kansas. Jackson County. Holton. South bank of creek in road cut, 3 miles south of Holton.","Holton, Jackson County, Kansas, United States, 66436",-95.7363723,39.4652724,-95.758534,-95.682316,39.4534469,39.4958311,2316
"USA, Nebraska, 2.5 miles southwest of Stine on north-south road. 12, N-54.2","North South Road, Hamilton County, Nebraska, United States",-97.9597101,40.9793598,-97.9701846,-97.9592863,40.8701677,41.0872706,11984
USA. Nebraska. Cass County. Nehawka. NW of Nehawka.,"Nehawka, Nehawka Precinct, Cass County, Nebraska, United States, 68413",-95.9915664,40.8303487,-95.997762,-95.9834449,40.824676,40.834061,800
"USA. Nebraska. Sarpy County. Kiewitz Quarry, just W of Meadow.","Sarpy County, Nebraska, United States",-96.195132,41.0744042,-96.339805,-95.841611,40.9943079,41.1909909,15071
USA. Kansas. Shawnee County. Topeka. Railroad cut 4.5 miles northeast of Topeka.,"Northwest Railroad Street, Topeka, Shawnee County, Kansas, United States, 66608",-95.6721726,39.0670649,-95.6755428,-95.6688031,39.0649275,39.0685667,336
USA. Nebraska. Otoe County. Nebraska City. Under the Burlington Bridge.,"Nebraska City, Otoe County, Nebraska, United States, 68410",-95.8593616,40.6765745,-95.8876049,-95.8358939,40.6491991,40.704263,3659
"USA, Kansas, Doniphan County, RR cut 2.5 miles southeast of Iowa Point.","Iowa Point, Iowa Township, Doniphan County, Kansas, United States, 66035",-95.238333,39.928333,-95.23968198,-95.23698402,39.92698402,39.92968198,189
"USA, Nebraska, Cass County, Weepingwater Creek, mouth of Weepingwater Creek N 25.3, 175","Weeping Water Road, Cass County, Nebraska, United States",-96.0303176,40.871246,-96.1209133,-95.93965,40.8610038,40.8811559,7721
USA. Nebraska. Cass County. Atwood Quarry on Cedar Creek.,"Cedar Creek, Eight Mile Grove Precinct, Cass County, Nebraska, United States, 68037",-96.1023468,41.0467204,-96.114791,-96.0900761,41.035769,41.0519739,1185
USA. Missouri. Harrison County. Bethany. Quarry 0.25 mi SW of falls at Bethany.,"Bethany, Bethany Township, Harrison County, Missouri, United States, 64424",-94.0093933,40.2895636,-94.01064223,-94.00794427,40.28816992,40.29086788,188
"USA, Nebraska, Pawnee County, Elk Creek, along railroad northeast of Elk Creek","Elk Creek, Todd Creek Precinct, Johnson County, Nebraska, United States, 68348",-96.129451,40.2858334,-96.1328599,-96.122674,40.2842719,40.2914839,338
USA. Nebraska. Nemaha County. Stine. ravine 1 mi W of Bracken or Stine.,"Nemaha County, Nebraska, United States",-95.8142885,40.4074745,-96.067091,-95.5509511,40.261216,40.5626278,26930
"USA. Nebraska. Sarpy County. Meadow. Kiewitz Quarry, just W of Meadow.","Sarpy County, Nebraska, United States",-96.195132,41.0744042,-96.339805,-95.841611,40.9943079,41.1909909,15071
"USA, Nebraska, Otoe County, Walnut Creek, 0.375 mi S of mouth of Walnut Creek","Walnut Street, Syracuse Precinct, Otoe County, Nebraska, United States, 68446",-96.1885501,40.6580503,-96.19051203,-96.18781407,40.6489846,40.668022,1020
"USA, Kansas, Wabaunsee County, 4 mi N and 1 mi W of Maple Hill","Maple Hill, Maple Hill Township, Wabaunsee County, Kansas, United States, 66507",-96.0282195,39.0845812,-96.031292,-96.0242411,39.0786189,39.09131,713
USA. Missouri. Daviess County. Gallatin. Railroad cut near Gallatin.,"Gallatin, Union Township, Daviess County, Missouri, United States, 64640",-93.9621669,39.9144513,-93.986198,-93.9470811,39.891998,39.925586,1787
USA. Oklahoma. Pontotoc County. 1 mi S of Ada.,"Ada, Pontotoc County, Oklahoma, United States",-96.6783449,34.774531,-96.7574741,-96.5648481,34.505934,34.840111,12680
"USA, New York, Monroe County, Rochester, Barge canal at Lee Rd.","Lee Road, Rochester, Monroe County, New York, United States, 14606",-77.6805906,43.1786234,-77.68180998,-77.67911202,43.1646491,43.1919476,1485
"Canada. Ontario. Welland County. Fort Erie. Ridgemount Quarry South, northwest corner of Ridgemount Rd  Bertie St, about 8 km west of Fort Erie, and about 11 km west of Niagara River, Bertie Township.","Ridgemount Road & Bertie Street, Fort Erie, Fort Erie, Regional Municipality of Niagara, Ontario, Canada, L0S 1N0",-79.0033072,42.9115952,-79.00465618,-79.00195822,42.91024622,42.91294418,186
"Czechoslovakia, Bohemia, Koneprusy","Koněprusy, Beroun 1, Beroun District, Central Bohemian Region, Czechia, 266 01",14.0657589,49.9208956,14.0460671,14.0906565,49.911917,49.9355943,1731
"Canada, Nova Scotia, Antigonish County, exposed in the first prominent seaward projecting cliff west of the mouth of Arisaig Brook along Northumberland Strait shore, Arisaig.","Arisaig, Antigonish County, Nova Scotia, Canada, B2G 2L1",-62.166667,45.75,-62.16801598,-62.16531802,45.74865102,45.75134898,183
"Canada. Nova Scotia. Antigonish County. Arisaig. Along shore, at mouth of and on the east bank of Arisaig Brook, southwest of Arisaig Point.","Arisaig, Antigonish County, Nova Scotia, Canada, B2G 2L1",-62.166667,45.75,-62.16801598,-62.16531802,45.74865102,45.75134898,183
"Canada. Quebec. Anticosti Island. West side of Ellis Bay, zone C. 306354","Anticosti Island, Minganie Regional County Municipality, Côte-Nord, Quebec, Canada, G0G",-62.9555318,49.5495194,-64.5239119,-61.6694982,49.0625037,49.9521358,102929
"Canada. Newfoundland. Forteau. About 0.5 mi west of the south end of Forteau village, Labrador. 347616","Forteau, Newfoundland and Labrador, Canada",-56.9575656,51.4736442,-56.972643,-56.918154,51.4555163,51.5022383,2273
USA. Arizona. Cochise County. Chiricahua Mountains.,"Chiricahua Mountains, Cochise County, Arizona, United States, 85625",-109.3822849,31.9298117,-109.3836339,-109.3809359,31.92846272,31.93116068,197
USA. Kentucky. Edmonson County. Brownsville.,"Brownsville, Edmonson County, Kentucky, United States, 42210",-86.2677545,37.1925472,-86.295251,-86.2453419,37.177937,37.217637,2931
"Germany. Rheinland-Pfalz. Bad Kreuznach. Drrebach. Drrebachtal. Drrebachtal, Drrebach, Stromberg, Bad Kreuznach Tal  Valley. , Bad Kreuznach","Stromberg, Bad Kreuznach, Rhineland-Palatinate, Germany, 55",7.7792771,49.9458981,7.7388849,7.7989911,49.9256297,49.9667743,2719
Germany. Rheinland-Pfalz. Oberstadtfeld.,"Oberstadtfeld, Vulkaneifel, Rhineland-Palatinate, Germany, 54570",6.7693791,50.1761864,6.7168472,6.7929591,50.1667509,50.1930381,2520
"Germany, Rheinland-Pfalz, Vulkaneifel, Oberstadtfeld.","Oberstadtfeld, Vulkaneifel, Rhineland-Palatinate, Germany, 54570",6.7693791,50.1761864,6.7168472,6.7929591,50.1667509,50.1930381,2520
USA. New York. Schoharie County. Schoharie.,"Schoharie, Schoharie, Schoharie County, New York, United States, 12157",-74.3095787,42.6659087,-74.3301381,-74.2988861,42.6521931,42.679723,1767
USA. Montana. Fergus County. Bear Gulch Lagerstatten.,"2749, Fairview Road, Forest Grove, Fergus County, Montana, United States, 59441",-109.0293776,46.9661138,-109.0307016,-109.0280036,46.96475387,46.96745183,182
USA. Illinois. Hardin County. Eichorn. 0.5 mi SSW of Eichorn.,"Eichorn, Stone Church Precinct, Hardin County, Illinois, United States, 62938",-88.4029539,37.490215,-88.40430288,-88.40160492,37.48886602,37.49156398,191
USA. Montana. Fergus County. Atherton Gulch Bear Gulch Lagerstatten.,"Fergus County, Montana, United States",-109.4141,47.2126745,-110.2135959,-108.313034,46.6934681,47.8034239,83877
USA. Michigan. Luce County. Newberry. Gravel pit on the southwest corner of the intersection of 123 and 28.,"Gravel Pit Tr, McMillan Township, Luce County, Michigan, United States, 49868",-85.322656,46.415613,-85.3370642,-85.3142759,46.4068472,46.4278129,1475
"USA. Texas. Brewster County. near Fenstermacher ranch house on the Old Word Ranch, Glass Mountains, west TX. , Brewster County","Glass Mountains, Pecos County, Texas, United States, 79735",-103.1090536,30.4354441,-103.1104026,-103.1077046,30.43409512,30.43679308,198
"USA, New York, Albany County, Countryman Hill, just W of New Salem.","New Salem Road, New Scotland, Albany County, New York, United States, 12186",-73.9631059,42.6349155,-73.9712488,-73.9499426,42.6226547,42.6474543,1517
"USA, Tennessee, Smith County, Rome, Highway 70N, 13 mi E of Lebanon","Rome, Smith County, Tennessee, United States, 37087",-86.0716556,36.2619973,-86.07300458,-86.07030662,36.26064832,36.26334628,193
USA. Tennessee. Blount County. Gullied slopes below the cemetery at the northeast edge of Friendsville.,"Friendsville, Blount County, Tennessee, United States",-84.1357453,35.7603575,-84.171103,-84.092634,35.733082,35.7802561,4403
Canada. Quebec. Anticosti Island. 1 mi W of White Cliff. 306313,"Anticosti Island, Minganie Regional County Municipality, Côte-Nord, Quebec, Canada, G0G",-62.9555318,49.5495194,-64.5239119,-61.6694982,49.0625037,49.9521358,102929
"Canada. Quebec. Anticosti Island. Cliff, W side of Vaureal Bay. 306328","Anticosti Island, Minganie Regional County Municipality, Côte-Nord, Quebec, Canada, G0G",-62.9555318,49.5495194,-64.5239119,-61.6694982,49.0625037,49.9521358,102929
"Canada, Quebec, Anticosti Island, Vaureal River section.","Anticosti Island, Minganie Regional County Municipality, Côte-Nord, Quebec, Canada, G0G",-62.9555318,49.5495194,-64.5239119,-61.6694982,49.0625037,49.9521358,102929
Canada. Quebec. Anticosti Island. East Cliff H. 306384,"Anticosti Island, Minganie Regional County Municipality, Côte-Nord, Quebec, Canada, G0G",-62.9555318,49.5495194,-64.5239119,-61.6694982,49.0625037,49.9521358,102929
Canada. Quebec. Anticosti Island. Cape MacGilvray.,"Anticosti Island, Minganie Regional County Municipality, Côte-Nord, Quebec, Canada, G0G",-62.9555318,49.5495194,-64.5239119,-61.6694982,49.0625037,49.9521358,102929
"Canada, Quebec, Anticosti Island, Cape James","Anticosti Island, Minganie Regional County Municipality, Côte-Nord, Quebec, Canada, G0G",-62.9555318,49.5495194,-64.5239119,-61.6694982,49.0625037,49.9521358,102929
Canada. Quebec. Anticosti Island. Back of Prinsta Bay. 306344,"Anticosti Island, Minganie Regional County Municipality, Côte-Nord, Quebec, Canada, G0G",-62.9555318,49.5495194,-64.5239119,-61.6694982,49.0625037,49.9521358,102929
Canada. Quebec. Anticosti Island. East Cliff.,"Anticosti Island, Minganie Regional County Municipality, Côte-Nord, Quebec, Canada, G0G",-62.9555318,49.5495194,-64.5239119,-61.6694982,49.0625037,49.9521358,102929
"Canada. Quebec. Anticosti Island. Heath Point, west of Cormorant Point.","Heath Point, Minganie, Côte-Nord, Québec, Canada, G0G 1P0",-61.7057364,49.0867923,-61.70708538,-61.70438742,49.08544332,49.08814128,179
Canada. Quebec. Anticosti Island. Jumpers 2.,"Anticosti Island, Minganie Regional County Municipality, Côte-Nord, Quebec, Canada, G0G",-62.9555318,49.5495194,-64.5239119,-61.6694982,49.0625037,49.9521358,102929
Canada. Quebec. Anticosti Island. Cliff 0.5 mi E of Junction Cliff. 306334,"Anticosti Island, Minganie Regional County Municipality, Côte-Nord, Quebec, Canada, G0G",-62.9555318,49.5495194,-64.5239119,-61.6694982,49.0625037,49.9521358,102929
"Mexico, Coahuila State, between El Tordillo  La Difunta and Cerro Caballo.","Los Difuntos, Coahuila de Zaragoza, Mexico, 25878",-101.46154,26.600158,-101.462889,-101.460191,26.59880902,26.60150698,201
USA. Arizona. Cochise County. Blue Mtn. Vanar quad.,"Vanar, Cochise County, Arizona, United States, 85632",-109.095058,32.2411912,-109.096407,-109.093709,32.23984222,32.24254018,196
"USA, Ohio, Hamilton County, Cincinnati","Cincinnati, Hamilton County, Ohio, United States",-84.5120196,39.1031182,-84.7123951,-84.3695489,39.0520649,39.2211029,17978
USA. Kentucky. Franklin County. Frankfort.,"Frankfort, Franklin County, Kentucky, United States, 40601",-84.8784682,38.1950324,-84.9214311,-84.809801,38.158082,38.22999,5567
USA. Minnesota. Ramsey County. St. Paul.,"Saint Paul, Ramsey County, Minnesota, United States",-93.0899578,44.9537029,-93.207787,-93.004324,44.887399,44.992016,7985
USA. New York. Oneida County. Rome.,"Rome, Oneida County, New York, United States",-75.4557303,43.2128473,-75.667017,-75.3409141,43.168892,43.2815229,12048
"Russia, Leningrad Oblast, Popovka near St. Petersburg.","Popovka, Kingiseppsky District, Leningrad Oblast, Russia, 188490",28.2033178,59.3948183,28.19737,28.2084858,59.391417,59.3980239,462
"USA, Minnesota, Dodge County, Old Concord.","Concord, Concord Township, Dodge County, Minnesota, United States, 55985",-92.8363068,44.1474641,-92.83765578,-92.83495782,44.14611512,44.14881308,185
"USA, Wisconsin, Iowa County, Mineral Point","Mineral Point, Mineral Point, Iowa County, Wisconsin, United States, 53565",-90.1798473,42.859997,-90.206058,-90.1575479,42.843788,42.8837761,2799
USA. Ohio. Montgomery County. Dayton.,"Dayton, Jefferson Township, Montgomery County, Ohio, United States",-84.1936144,39.7592225,-84.311377,-84.092938,39.7018339,39.9208231,11938
USA. Minnesota. Hennepin County. St. Anthony Falls.,"Saint Anthony Falls, Saint Anthony Main, Minneapolis, Hennepin County, Minnesota, United States, 55414",-93.2555026,44.9821877,-93.25685158,-93.25415362,44.98083872,44.98353668,184
USA. New York. Oneida County. Trenton Falls.,"Trenton, Oneida County, New York, United States",-75.2245693,43.228708,-75.2872939,-75.1064949,43.181769,43.325387,7292
USA. Kentucky. Franklin County.,"Franklin County, Kentucky, United States",-84.8984775,38.2481018,-85.0242641,-84.7251679,38.093437,38.374836,20402
USA. Oklahoma. Pontotoc County. Franks. 295421,"Pontotoc County, Oklahoma, United States",-96.663812,34.7685043,-96.9325801,-96.406048,34.5053889,34.9652131,32120
USA. Ohio. Hamilton County. Cincinnati.,"Cincinnati, Hamilton County, Ohio, United States",-84.5120196,39.1031182,-84.7123951,-84.3695489,39.0520649,39.2211029,17978
"USA, Oklahoma, Pontotoc County, Arbuckle Mountain, Franks section","230, West 12th Street, Ada, Pontotoc County, Oklahoma, United States, 74820",-96.6817245,34.7736129,-96.68306598,-96.68036802,34.77217607,34.77487403,187
USA. Virginia. Scott County. Mount Hagan schoolgrounds.,"Scott County, Virginia, United States",-82.605118,36.6815794,-82.9851241,-82.2941341,36.5934609,36.885606,35364
USA. Tennessee. Cannon County. 1 Mi SE of Woodbury.,"Woodbury, Cannon County, Tennessee, United States, 37190",-86.0716565,35.8275672,-86.0971939,-86.046933,35.809923,35.840016,2626
"Canada, Quebec, Junction Cliff.","Québec City, Québec, Capitale-Nationale, Quebec, Canada",-71.2074596,46.8130816,-71.5490766,-71.1407543,46.7335454,46.9807385,19319
"USA, Tennessee, Grainger County, Washburn.","Washburn, Grainger County, Tennessee, United States, 37888",-83.5955574,36.2894746,-83.59690638,-83.59420842,36.28812562,36.29082358,193
"USA. Kansas. Shawnee County. Topeka. Topeka Clay Pit, west of Topeka.","Southwest Clay Street, Topeka, Shawnee County, Kansas, United States",-95.690853,39.042678,-95.6931356,-95.6826122,39.0222803,39.0629896,2273
"USA. Nebraska. Richardson County. Church Farm, 2.5 mi SE of Du Bois.","Du Bois, 6, South Fork, Pawnee County, Nebraska, United States, 68345",-96.0483352,40.0347221,-96.0576539,-96.0386781,40.029685,40.040623,972
USA. Nebraska. Otoe County. Dunbar. old quarry SE of Dunbar.,"Dunbar, Delaware Precinct, Otoe County, Nebraska, United States, 68346",-96.0280624,40.6686132,-96.0391799,-96.022988,40.663642,40.67256,613
USA. Nebraska. Otoe County. Unadilla. 2 mi SE of Unadilla.,"Nebraska 2, Unadilla, South Russell Precinct, Otoe County, Nebraska, United States",-96.2690154,40.6854718,-96.2754296,-96.2638923,40.6827471,40.6898863,621
USA. Missouri. Jackson County. Kansas City. along Turkey Creek.,"Kansas City, Jackson County, Missouri, United States",-94.5785667,39.0997265,-94.765567,-94.385448,38.824259,39.3562099,32998
USA. Missouri. Jackson County. Kansas City. Quarries along Turkey Creek.,"Kansas City, Jackson County, Missouri, United States",-94.5785667,39.0997265,-94.765567,-94.385448,38.824259,39.3562099,32998
USA. Nebraska. Cass County. Burlington Quarry.,"Cass County, Nebraska, United States",-96.1526985,40.8755529,-96.463861,-95.809379,40.78347,41.0660011,28169
USA. Missouri. Grundy County. Trenton. 1 mi W of Trenton.,"Trenton, Trenton Township, Grundy County, Missouri, United States, 64683",-93.6166074,40.0789018,-93.6369371,-93.5608449,40.058796,40.119052,2827
"USA, Kansas, Allen County, Iola, 0.25 mi W of Cement Plant Quarry at Iola","West Street, Iola, Iola Township, Allen County, Kansas, United States, 66749",-95.4090702,37.9222489,-95.4129566,-95.4054978,37.92086652,37.92356448,346
USA. Kansas. Wyandotte County. Muncie. 2 mi NE of Muncie.,"Muncie Drive, Muncie, Kansas City, Wyandotte County, Kansas, United States, 66111",-94.7420089,39.0836127,-94.7465109,-94.7368076,39.0801183,39.087008,550
USA. Missouri. Clay County. Kansas City. Water Works.,"1, Northwest Briarcliff Road, Kansas City, Gallatin Township, Clay County, Missouri, United States, 64116, 1655",-94.5840523,39.1576688,-94.58527688,-94.58257892,39.15625352,39.15895148,189
"USA, Nebraska, Cass County, Nehawka, Snyderville Quarry","Nehawka, Nehawka Precinct, Cass County, Nebraska, United States, 68413",-95.9915664,40.8303487,-95.997762,-95.9834449,40.824676,40.834061,800
"USA. Nebraska. Cass County. Weeping Water. Chonetes zone immediately below the blue ledge, 1 mi N  1 mi E of Weeping Water.  609, N35.5  , Cass County","Weeping Water, Cass County, Nebraska, United States, 68463",-96.139972,40.8699301,-96.159118,-96.125701,40.8590901,40.880047,1646
"USA, Oklahoma, Nowata County, 4 mi NW of Nowata","Nowata, Nowata County, Oklahoma, United States, 74048",-95.6380341,36.700645,-95.656801,-95.562089,36.676821,36.725283,3131
USA. Nebraska. Cass County. Nehawka. Shoemaker Bridge.,"Nehawka, Nehawka Precinct, Cass County, Nebraska, United States, 68413",-95.9915664,40.8303487,-95.997762,-95.9834449,40.824676,40.834061,800
USA. Missouri. Harrison County. Melbourne.,"Harrison County, Missouri, United States",-93.9878427,40.3219529,-94.23238,-93.7631741,40.132909,40.5775481,29560
"USA, Nebraska, Cass County, Weeping Water, NE of Weeping Water","101, West Eldora Avenue, Weeping Water, Cass County, Nebraska, United States, 68463",-96.1404785,40.8697633,-96.14182693,-96.13912897,40.86849607,40.87119403,181
"USA. Texas. Brewster County. North of Leonard Mountain, southeast of hill 5453, Glass Mountains.","Brewster County, Texas, United States",-103.3587288,29.6629938,-103.80068,-102.3208982,28.971547,30.6659389,87845
"USA. Texas. Brewster County. West side of Gilliland Canyon, west of Road Canyon, Glass Mountains.","Brewster County, Texas, United States",-103.3587288,29.6629938,-103.80068,-102.3208982,28.971547,30.6659389,87845
"USA. Texas. Brewster County. Glass Mountains. layer of ls in sh, 1 mi NW of station 3, sheet 2, stations 21 and 22, Glass Mountains, west TX.  T091  Early Permian. Wolfcampian. Wolfcamp Fm., Brewster County","Glass Mountains, Pecos County, Texas, United States, 79735",-103.1090536,30.4354441,-103.1104026,-103.1077046,30.43409512,30.43679308,198
"USA. Texas. between stations 60 and 62, Green Canyon, Glass Mountains, west TX.  TA  Permian. Word Fm.","Glass Mountains, Pecos County, Texas, United States, 79735",-103.1090536,30.4354441,-103.1104026,-103.1077046,30.43409512,30.43679308,198
"USA, Texas, Brewster County, Hess Canyon, Glass Mountains.","Hess Canyon, Brewster County, Texas, United States, 79831",-103.2004472,30.4473858,-103.2017962,-103.1990982,30.44603682,30.44873478,198
"USA, Texas, Brewster County, near the tank 0.25 mi N of Word Ranch, Glass Mountains, west Texas. TX148","Glass Mountains, Pecos County, Texas, United States, 79735",-103.1090536,30.4354441,-103.1104026,-103.1077046,30.43409512,30.43679308,198
"USA. Texas. Brewster County, Glass Mountains, west TX. Bowman's section 2.5 mi up valley from Hess Tank.","Glass Mountains, Pecos County, Texas, United States, 79735",-103.10905,30.4354441,-103.1104,-103.1077,30.4340951,30.4367931,198
"USA, Texas, Brewster County, Glass Mountains.","Glass Mountains, Pecos County, Texas, United States, 79735",-103.1090536,30.4354441,-103.1104026,-103.1077046,30.43409512,30.43679308,198
"USA. Arizona. Mohave County. Bass Ranch, Grand Canyon.","Grand Canyon Village, Coconino County, Arizona, United States, 86023",-112.1401108,36.0544445,-112.246748,-112.0806041,36.0040579,36.111439,8290
"USA. Texas. Brewster County. Section 12, below hill 4920, north of locality B3052, Glass Mountains, west Texas.","Glass Mountains, Pecos County, Texas, United States, 79735",-103.1090536,30.4354441,-103.1104026,-103.1077046,30.43409512,30.43679308,198
"USA. Texas. Brewster County. Between and south of hills 5767 and 5821, Glass Mountains, west Texas.","Glass Mountains, Pecos County, Texas, United States, 79735",-103.1090536,30.4354441,-103.1104026,-103.1077046,30.43409512,30.43679308,198
"USA. Texas. Brewster County. Base of range about 1 mi W of Sullivan-Marathon road, Glass Mountains.","Marathon Road, Brewster County, Texas, United States",-103.2732589,29.5603231,-103.3702811,-103.139435,29.4797259,29.6169141,12972
India. Punjab. Jhelum District. 0.75 mi SW of Tatrot village 43H5 quadrant A2.,India,78.96288,20.593684,68.1097,97.3953587,6.4626999,35.6733149,1953528
USA. South Dakota. Dewey County. Eagle Butte. From excavations for Indian Bureau building.,"Eagle Butte, North Dewey, Ziebach County, South Dakota, United States, 57625",-101.2224805,44.9886537,-101.269331,-101.2107239,44.9790949,45.0099921,2546
"USA, Wyoming, Weston County, about 10 miles southwest of Newcastle","Newcastle, Weston County, Wyoming, United States, 82701",-104.2049408,43.8547003,-104.2699491,-104.172,43.840154,43.880623,3912
USA. Nebraska. Sarpy County. Meadow Station. Kiewitz Quarry.,"Meadow Lane, La Vista, La Vista Precinct, Sarpy County, Nebraska, United States, 68128",-96.0291432,41.1775964,-96.0308654,-96.0261939,41.17688942,41.17958738,164
"USA, South Dakota, Ziebach County, bluffs south of the Moreau River, between the forks of the county roads leading northwest to the village and north to the bridge, about 1 mile southeast of Thunder Butte village.","Moreau River, South Dakota, United States",-101.7472359,45.23776582,-102.8710585,-100.6234133,45.1081969,45.3673348,89310
"USA. South Dakota. Stanley County. Fort Pierre, south of the Missouri River.","Fort Pierre, South Stanley, Stanley County, South Dakota, United States, 57532",-100.3737447,44.3535933,-100.400762,-100.3588411,44.3447721,44.389516,2367
USA. Colorado. Boulder County. Boulder.,"Boulder, Boulder County, Colorado, United States",-105.2747406,40.0189728,-105.30145,-105.178355,39.9569151,40.094412,7258
"USA. Montana. Toole County. Shelby. 8 mi W of US Rt 15,  4 mi NW of Kevin.","Shelby, Toole County, Montana, United States, 59474",-111.8561447,48.5066603,-111.9178579,-111.8236731,48.4219451,48.54502,4894
