originalPlace,interpretedPlace,longitude,latitude,xmin,xmax,ymin,ymax,uncertainty
"USA. Texas. Hudspeth County. Fossil Hill, Finlay Dome, N of Finlay, Finaly Mountains, west TX.  3892513  , Hudspeth County","Finlay, Hudspeth County, Texas, United States, 79851",-105.629444,31.258611,-105.630793,-105.628095,31.25726202,31.25995998,197
"USA. Texas. Brewster County, south of Sullivan Peak, Glass Mountains.","Glass Mountains, Pecos County, Texas, United States, 79735",-103.10905,30.4354441,-103.1104,-103.1077,30.4340951,30.4367931,198
"USA. Texas. Brewster County. W side of fault on spur N of Leonard Mt, Glass Mountains, west TX.","Glass Mountains, Pecos County, Texas, United States, 79735",-103.10905,30.4354441,-103.1104,-103.1077,30.4340951,30.4367931,198
"USA, Texas, Brewster County, west of Comanche outlier north of Word Ranch, Glass Mountains.","Glass Mountains, Pecos County, Texas, United States, 79735",-103.10905,30.4354441,-103.1104,-103.1077,30.4340951,30.4367931,198
"USA. Texas. Brewster County. 0.5 mi SE of hill 5803, N side of Road Canyon, Glass Mountains, west TX. 3892243","Glass Mountains, Pecos County, Texas, United States, 79735",-103.10905,30.4354441,-103.1104,-103.1077,30.4340951,30.4367931,198
"USA, Texas, Hudspeth County, 6 miles south of Dos Alamos, Sierra Diablo, west Texas.","Sierra Diablo, Culberson County, Texas, United States, 79855",-104.9049435,31.4229024,-104.9062925,-104.9035945,31.42155342,31.42425138,197
"USA. Texas. Brewster County. On scarp east of the head of the east fork of Hess Canyon, about 0.25 miles below and southeast of hill 5767, Glass Mountains, west Texas.","Hess Canyon, Brewster County, Texas, United States, 79842",-103.2071162,30.3337771,-103.2084652,-103.2057672,30.33242812,30.33512608,198
"USA, Texas, near Bone Spring, Guadalupe Mountains, west TX. 3892221",NA,NA,NA,NA,NA,NA,NA,NA
"USA. Texas. Brewster County, Glass Mountains, west TX.","Glass Mountains, Pecos County, Texas, United States, 79735",-103.10905,30.4354441,-103.1104,-103.1077,30.4340951,30.4367931,198
"USA. Texas. Culberson County. Entrance to Victorio Canyon, Sierra Diablo, west TX.","Victorio Canyon, Culberson County, Texas, United States, 79855",-104.8632755,31.3504045,-104.8646245,-104.8619265,31.34905552,31.35175348,197
"USA. Texas. Brewster County. Several miles north of Word Ranch house, Glass Mountains, west TX.","Glass Mountains, Pecos County, Texas, United States, 79735",-103.10905,30.4354441,-103.1104,-103.1077,30.4340951,30.4367931,198
"USA. Texas. Brewster County. Section 23, south side of hill 5611, west side of Hess Canyon, Glass Mountains, west Texas.","Hess Canyon, Brewster County, Texas, United States, 79842",-103.2071162,30.3337771,-103.2084652,-103.2057672,30.33242812,30.33512608,198
"USA, Texas, west of Guadalupe Point, in hills north of the highway from Van Horn to Carlsbad, Guadalupe Mountains.","El Capitan, Culberson County, Texas, United States, 79847",-104.8580032,31.8773383,-104.8593522,-104.8566542,31.87598932,31.87868728,197
"USA. Texas. Brewster County. 0.5 mi N of Hess Ranch, at W end of ridge, Glass Mountains.","Glass Mountains, Pecos County, Texas, United States, 79735",-103.10905,30.4354441,-103.1104,-103.1077,30.4340951,30.4367931,198
"USA. Texas. Hudspeth County. cgl bed, Finlay Dome, S of Fossil Hill, N of Finlay, Finlay Mountains, west TX.  3892511  , Hudspeth County","Finlay Mountains, Hudspeth County, Texas, United States, 79851",-105.5874606,31.3556794,-105.5888096,-105.5861116,31.35433042,31.35702838,197
"USA. Texas. Brewster County. Section 12, south of Sullivan Peak, Glass Mountains, west TX. 389231","Glass Mountains, Pecos County, Texas, United States, 79735",-103.10905,30.4354441,-103.1104,-103.1077,30.4340951,30.4367931,198
"USA, Texas, Pecos County, Glass Mountains, Section H.","Glass Mountains, Pecos County, Texas, United States, 79735",-103.1090536,30.4354441,-103.1104026,-103.1077046,30.43409512,30.43679308,198
"USA, Texas, Brewster County, Glass Mountains, Section 14, 2 miles WSW of Iron Mountain, west Texas.","Glass Mountains, Pecos County, Texas, United States, 79735",-103.1090536,30.4354441,-103.1104026,-103.1077046,30.43409512,30.43679308,198
"USA, Texas, Brewster County, Glass Mountains, Section 10.","Glass Mountains, Pecos County, Texas, United States, 79735",-103.1090536,30.4354441,-103.1104026,-103.1077046,30.43409512,30.43679308,198
"USA, Texas, Brewster County, Glass Mountains, about 1 mile west of the Marathon-Sullivan road.","Glass Mountains, Pecos County, Texas, United States, 79735",-103.1090536,30.4354441,-103.1104026,-103.1077046,30.43409512,30.43679308,198
USA. Texas. Brewster County. Glass Mountains. 389233a,"Glass Mountains, Pecos County, Texas, United States, 79735",-103.1090536,30.4354441,-103.1104026,-103.1077046,30.43409512,30.43679308,198
USA. Texas. Brewster County. Glass Mountains. Section 12. Lenox Hills. West Texas. 389219,"Glass Mountains, Pecos County, Texas, United States, 79735",-103.1090536,30.4354441,-103.1104026,-103.1077046,30.43409512,30.43679308,198
"USA. Texas. Brewster County. at base of escarpment between Sullivan-Marathon road and a point .5 mi to W, Glass Mountains, west TX.","Glass Mountains, Pecos County, Texas, United States, 79735",-103.1090536,30.4354441,-103.1104026,-103.1077046,30.43409512,30.43679308,198
"USA. Texas. Brewster County, south of Cathedral Mt, Glass Mountains, west Texas. 389232","Cathedral Mountain, Brewster County, Texas, United States, 79831",-103.3465674,30.3096059,-103.3479164,-103.3452184,30.30825692,30.31095488,198
"USA. Texas. Brewster County. North of Willis Ranch, Glass Mountains.","Glass Mountains, Pecos County, Texas, United States, 79735",-103.1090536,30.4354441,-103.1104026,-103.1077046,30.43409512,30.43679308,198
"USA, Texas, Brewster County, Glass Mountains, near Clay Slide.","Glass Mountains, Pecos County, Texas, United States, 79735",-103.1090536,30.4354441,-103.1104026,-103.1077046,30.43409512,30.43679308,198
"USA. Texas. Brewster County. 1.5 mi NE of Altuda, Glass Mountains, west TX. 389257","Altuda, Brewster County, Texas, United States, 79830",-103.4575,30.301944,-103.458849,-103.456151,30.30059502,30.30329298,198
"USA. Texas. Brewster County. Section 12, either locality B3074, B3075, or B3076, South of Sullivan Peak, Glass Mountains, West Texas.","Glass Mountains, Pecos County, Texas, United States, 79735",-103.1090536,30.4354441,-103.1104026,-103.1077046,30.43409512,30.43679308,198
"USA. Texas. Brewster County. Glass Mountains, west TX. Section 12, SW side of hill 4920.","Glass Mountains, Pecos County, Texas, United States, 79735",-103.1090536,30.4354441,-103.1104026,-103.1077046,30.43409512,30.43679308,198
"USA, Texas, Brewster County, northeast part of Del Notre Range, south of James Ranch, Glass Mountains, west Texas.","Glass Mountains, Pecos County, Texas, United States, 79735",-103.1090536,30.4354441,-103.1104026,-103.1077046,30.43409512,30.43679308,198
"USA, Texas, Pecos County, north of hill 4627, northeast corner of Hess Canyon quadrangle, Glass Mountains, west Texas.","Glass Mountains, Pecos County, Texas, United States, 79735",-103.1090536,30.4354441,-103.1104026,-103.1077046,30.43409512,30.43679308,198
"USA, Texas, Brewster County, north of Word Ranch, east and west of Comanche outlier for a short distance, Glass Mountains.","Glass Mountains, Pecos County, Texas, United States, 79735",-103.10905,30.4354441,-103.1104,-103.1077,30.4340951,30.4367931,198
"USA. Texas. Brewster County, 0.6 mi WSW of hill 5725, NW of Wolf Camp, Glass Mountains, west TX. 3892212","Glass Mountains, Pecos County, Texas, United States, 79735",-103.10905,30.4354441,-103.1104,-103.1077,30.4340951,30.4367931,198
"USA, Texas, Brewster County, 1 mi NW of Wolfcamp, Section 23, Glass Mountains, west TX.","Glass Mountains, Pecos County, Texas, United States, 79735",-103.1090536,30.4354441,-103.1104026,-103.1077046,30.43409512,30.43679308,198
"USA. Texas. Brewster County. 1 mi NW of Wolfcamp, Section 23, Glass Mountains, west TX.","Glass Mountains, Pecos County, Texas, United States, 79735",-103.1090536,30.4354441,-103.1104026,-103.1077046,30.43409512,30.43679308,198
"USA. Texas. El Paso County. Powwow Canyon, Hueco Mountains, west TX.  3892377A","Pow Wow Canyon, Butterfield, El Paso County, Texas, United States, 79938",-106.0936246,31.8322491,-106.0964432,-106.0890023,31.83087657,31.83357453,307
"USA. Texas. Brewster County. On spur north of high point of Leonard Mountain, east side of fault at east end of the mountain, Glass Mountains, west Texas.","Glass Mountains, Pecos County, Texas, United States, 79735",-103.1090536,30.4354441,-103.1104026,-103.1077046,30.43409512,30.43679308,198
"USA. Texas. Hudspeth County. 11.5 mi S of Dos Alamos, Sierra Diablo, west TX. 3892506","Sierra Diablo, Culberson County, Texas, United States, 79855",-104.9049435,31.4229024,-104.9062925,-104.9035945,31.42155342,31.42425138,197
"USA. Texas. Brewster County. Glass Mountains. Near top of a hill in the middle Hess, Section 27.","Glass Mountains, Pecos County, Texas, United States, 79735",-103.1090536,30.4354441,-103.1104026,-103.1077046,30.43409512,30.43679308,198
"USA. Texas. El Paso County, 2 mi SW of the SW corner of Cerro Alto, Hueco Mountains, west TX.","Cerro Alto, El Paso County, Texas, United States, 79938",-106.063609,31.857273,-106.0647239,-106.062026,31.855705,31.8588155,203
"USA. Texas. Hudspeth County. SW foot of Cerro Alto, Hueco Mountains.","Cerro Alto, El Paso County, Texas, United States, 79938",-106.063609,31.857273,-106.0647239,-106.062026,31.855705,31.8588155,203
"USA. Texas. Pecos County. Glass Mountains. Lower part of a hill in the northeast corner of the Hess Canyon quadrangle, west TX.","Glass Mountains, Pecos County, Texas, United States, 79735",-103.1090536,30.4354441,-103.1104026,-103.1077046,30.43409512,30.43679308,198
"USA. Texas. Pecos County. 0.35 mi SE of hill 4108, north-central part of Sierra Madera, Glass Mountains, west TX.","Sierra Madera crater, Pecos County, Texas, United States",-102.9126567,30.5926639,-102.9140057,-102.9113077,30.59131492,30.59401288,198
"USA, Texas, Brewster County, Glass Mountains, near Gap Tank, about 0.25 mi east of the edge of the Hess Canyon quadrangle, west Texas.","Hess Canyon, Brewster County, Texas, United States, 79842",-103.2071162,30.3337771,-103.2084652,-103.2057672,30.33242812,30.33512608,198
"USA. Texas. Brewster County. 5 mi NE of Wolf Camp, SE flank of Glass Mountains.","Glass Mountains, Pecos County, Texas, United States, 79735",-103.1090536,30.4354441,-103.1104026,-103.1077046,30.43409512,30.43679308,198
"USA, Texas, Brewster County, west end of Glass Mountains.","Glass Mountains, Pecos County, Texas, United States, 79735",-103.1090536,30.4354441,-103.1104026,-103.1077046,30.43409512,30.43679308,198
"USA. Texas. Culberson County. El Capitan, Guadalupe Mountains.","El Capitan, Culberson County, Texas, United States, 79847",-104.8580032,31.8773383,-104.8593522,-104.8566542,31.87598932,31.87868728,197
"USA. Texas. Brewster County. East base of Leonard Mountain, Glass Mountains.","Glass Mountains, Pecos County, Texas, United States, 79735",-103.1090536,30.4354441,-103.1104026,-103.1077046,30.43409512,30.43679308,198
"USA. Texas. Brewster County, Section 17, north of Leonard Mountain, Glass Mountains, west Texas. 3892121","Glass Mountains, Pecos County, Texas, United States, 79735",-103.1090536,30.4354441,-103.1104026,-103.1077046,30.43409512,30.43679308,198
"USA, Texas, Brewster County, Glass Mountains. Section 17, west TX.","Glass Mountains, Pecos County, Texas, United States, 79735",-103.1090536,30.4354441,-103.1104026,-103.1077046,30.43409512,30.43679308,198
"USA. Texas. Brewster County, north of Dugout Mountain, Glass Mountains, west Texas.","Dugout Mountain, Brewster County, Texas, United States",-103.4087932,30.2087732,-103.4101422,-103.4074442,30.20742422,30.21012218,198
"USA, Texas, Brewster County, southwest of the southern part of Comanche outlier, north of Word Ranch house, Glass Mountains, west Texas.","Glass Mountains, Pecos County, Texas, United States, 79735",-103.1090536,30.4354441,-103.1104026,-103.1077046,30.43409512,30.43679308,198
"USA. Texas. Brewster County, south side of Cathedral Mountain, Glass Mountains, west Texas.","Cathedral Mountain, Brewster County, Texas, United States, 79831",-103.3465674,30.3096059,-103.3479164,-103.3452184,30.30825692,30.31095488,198
"USA. Texas. Brewster County. South middle part of Hess Ranch horst, west end, 2.5 mi northeast of Hess Ranch, Glass Mountains, west Texas.","Glass Mountains, Pecos County, Texas, United States, 79735",-103.1090536,30.4354441,-103.1104026,-103.1077046,30.43409512,30.43679308,198
"USA. Texas. Hudspeth County. 2 mi S of the summit of Cerro Alto, Hueco Mountains.","Hudspeth County, Texas, United States",-105.5943388,31.5707433,-105.9980067,-104.9071221,30.6291266,32.0023501,80788
"USA. Texas. Brewster County. SW side of hill 4920, Glass Mountains, west TX. 389225","Glass Mountains, Pecos County, Texas, United States, 79735",-103.1090536,30.4354441,-103.1104026,-103.1077046,30.43409512,30.43679308,198
USA. Texas. Brewster County. Glass Mountains.,"Glass Mountains, Pecos County, Texas, United States, 79735",-103.1090536,30.4354441,-103.1104026,-103.1077046,30.43409512,30.43679308,198
"USA. Texas. Presidio County. Near the divide east of Ross Mine, Chinati Mountains, west TX.","Ross Mine, Presidio County, Texas, United States, 79843",-104.3874209,29.8160062,-104.3887699,-104.3860719,29.81465722,29.81735518,198
"USA. New York. Steuben County. 1250-ft elev., 1.3 mi N up Stephens Creek from Carson-Adrian Rd,  2.7 mi ENE of Canisteo.","Canisteo, Canisteo, Steuben County, New York, United States, 14823",-77.6058225,42.2703487,-77.6180649,-77.590035,42.2591189,42.281698,1605
USA. Tennessee. Benton County. Camden.,"Camden, Benton County, Tennessee, United States, 38320",-88.0978151,36.0589486,-88.1304849,-88.0780661,36.0401161,36.0897561,3610
"Sweden, Gotland.","Gotland, Gotland County, Sweden",18.4867447,57.4684121,18.085562,19.1228587,56.9049485,57.9298153,63869
"USA, Arizona, Gila County, 0.3 mi north up gully from Rt. 77, 1.3 mi north-northeast of Winkelman. AZ09","Winkelman, Gila County, Arizona, United States",-110.7709387,32.9875659,-110.774822,-110.7574521,32.9758759,32.994101,1346
"Italy. Trento Province. Trento, Tyrol.","Autonomous Province of Trento, Trentino-South Tyrol, Italy",11.1175392,46.0512004,10.4521314,11.9626787,45.6730625,46.5327642,66607
"France, Nouvelle-Aquitaine, La Rochelle","La Rochelle, Charente-Maritime, Nouvelle-Aquitaine, France",-1.151139,46.160329,-1.2418785,-1.1110691,46.1331579,46.1909446,4599
"Canada, Quebec, Cape Blanc, southwest of Perce, Gaspe Peninsula.","Gaspé Peninsula, La Haute-Gaspésie Regional County Municipality, Gaspésie–Îles-de-la-Madeleine, Quebec, Canada, G4V 2E4",-65.8333333,48.6666667,-65.83468228,-65.83198432,48.66531772,48.66801568,180
"Canada, Quebec, along crest of ridge, Reddish Point Pointe Reddish. 389119b","Quebec, Canada",-73.5491361,52.9399159,-79.7642783,-57.1054864,44.9913581,62.6110383,993329
"USA. West Virginia. Pendleton County. Road cut about 12 miles west of Franklin, along U.S. Route 33.","U.S. Route 33, Franklin, Pendleton County, West Virginia, United States",-79.3299213,38.6511411,-79.3325889,-79.3238122,38.6476083,38.6550231,456
"USA, Nebraska, Otoe County, Nebraska City, Clay Pit","Nebraska City, Otoe County, Nebraska, United States, 68410",-95.8593616,40.6765745,-95.8876049,-95.8358939,40.6491991,40.704263,3659
"USA. Arkansas. Marion County. Yellville. drusy, red-stained, porous chert of Black Ledge, 40-60 fft above base of Powell, 3 mi N by NE of Yellville.  MSM A4.8  , Marion County","Yellville, Marion County, Arkansas, United States, 72687",-92.6847511,36.2260416,-92.707067,-92.669052,36.2112649,36.2463031,2591
"USA, Texas, Brewster County, Hess Canyon, 4 miles northeast of Hess Ranch and about 2 miles west of Old Word Ranch, Glass Mountains.","Hess Canyon, Brewster County, Texas, United States, 79842",-103.2071162,30.3337771,-103.2084652,-103.2057672,30.33242812,30.33512608,198
"Canada, Quebec, Anticosti Island, Jumpers.","Anticosti Island, Minganie Regional County Municipality, Côte-Nord, Quebec, Canada, G0G",-62.9555318,49.5495194,-64.5239119,-61.6694982,49.0625037,49.9521358,102929
Canada. Quebec. Anticosti Island. Southwest Point.,"Anticosti Island, Minganie Regional County Municipality, Côte-Nord, Quebec, Canada, G0G",-62.9555318,49.5495194,-64.5239119,-61.6694982,49.0625037,49.9521358,102929
"Canada, Quebec, about 0.5 mi east of Death Point Pointe des Morts, Anticosti Island.","Pointe des Morts, Minganie Regional County Municipality, Côte-Nord, Quebec, Canada",-63.0818256,49.2221874,-63.08317458,-63.08047662,49.22083842,49.22353638,179
Canada. Quebec. Anticosti Island. Junction Cliff. 306335,"Anticosti Island, Minganie Regional County Municipality, Côte-Nord, Quebec, Canada, G0G",-62.9555318,49.5495194,-64.5239119,-61.6694982,49.0625037,49.9521358,102929
"Canada. Quebec. West Box River Cliff, Anticosti Island.","Anticosti Island, Minganie Regional County Municipality, Côte-Nord, Quebec, Canada, G0G",-62.9555318,49.5495194,-64.5239119,-61.6694982,49.0625037,49.9521358,102929
Canada. Quebec. Anticosti Island. Wreck Beach C. 306374,"Anticosti Island, Minganie Regional County Municipality, Côte-Nord, Quebec, Canada, G0G",-62.9555318,49.5495194,-64.5239119,-61.6694982,49.0625037,49.9521358,102929
United Kingdom. England. Hereford. Eastnor.,"Eastnor, Ledbury, Herefordshire, England, United Kingdom, HR8",-2.391321,52.029936,-2.3958585,-2.3861355,52.0261125,52.0350405,527
USA. New York. Albany County. New Salem. Countryman Hill.,"New Salem, New Scotland, Albany County, New York, United States, 12186",-73.96889,42.62278,-73.97023898,-73.96754102,42.62143102,42.62412898,186
USA. New York. Orange County. Deer Park.,"Deerpark, Orange County, New York, United States",-74.663464,41.4591459,-74.762623,-74.529751,41.347772,41.502394,12157
USA. New York. Otsego County. Cherry Valley.,"Cherry Valley, Cherry Valley, Otsego County, New York, United States, 13320",-74.7532018,42.7956294,-74.760953,-74.7406109,42.792251,42.804612,737
"Canada. Newfoundland. West side of Long Point at Black Duck Cove, the ledges are seen as reefs out in the water. 345018","Black Duck Cove, Newfoundland and Labrador, Canada, A0K 0C6",-56.798466,51.195687,-56.79981498,-56.79711702,51.19433802,51.19703598,177
"Canada. Newfoundland. Long Point. Along the west shore of Long Point, within 0.5 miles south of the lighthouse. 345016","Long Point, Newfoundland and Labrador, Canada, A0N 1T1",-58.796656,48.7628259,-58.79800498,-58.79530702,48.76147692,48.76417488,180
"Canada, Newfoundland, north of Lighthouse along Gulf shore, Point Riche, western Newfoundland.","Pointe Riche, Port au Choix, Terre-Neuve-et-Labrador, Canada, A0K 4C0",-57.4084183,50.6959554,-57.40976728,-57.40706932,50.69460642,50.69730438,178
"USA. Texas. Brewster County, about .25 mi W of the Fenstermacher ranch house on the Old Word Ranch, Glass Mountains.","Brewster County, Texas, United States",-103.3587288,29.6629938,-103.80068,-102.3208982,28.971547,30.6659389,87845
"USA, Texas, Brewster County, Split Tank on Fenstermacher Ranch Old Word Ranch, Glass Mountains.","Brewster County, Texas, United States",-103.3587288,29.6629938,-103.80068,-102.3208982,28.971547,30.6659389,87845
USA. New York. Monroe County. Pittsford. Area excavated for 1996 construction of Wegmans Supermarket currently located at 3195 Monroe Avenue.,"3195, Monroe Avenue, Rochester, Pittsford, Monroe County, New York, United States, 14618",-77.543491,43.106588,-77.54451588,-77.54181792,43.10507562,43.10777358,188
USA. New York. Monroe County. Brighton. 0.1 km S of intersection of NY 31 Monroe Ave  Westfall Rd.,"Monroe Avenue & Westfall Road, Brighton, Brighton, Monroe County, New York, United States, 14618",-77.5538178,43.1165097,-77.55516678,-77.55246882,43.11516072,43.11785868,186
"Canada. Ontario. Grey County. Owen Sound. about 1 mi E of Seldon Hotel, on top of Clinton escarpment.","Owen Sound, Grey County, Ontario, Canada",-80.9405602,44.5690305,-80.964285,-80.891868,44.540959,44.6096379,3645
"Canada. Ontario. Manitoulin County. Manitowaning. top layers, The Rocks, back of Manitowaning.  31943  , Manitoulin County","Manitowaning, Assiginack, Manitoulin District, Ontario, Canada, P0P 1N0",-81.813685,45.737315,-81.81503398,-81.81233602,45.73596602,45.73866398,183
Canada. Ontario. Region of Peel. Cataract. Cataract Falls. 342630,"Cataract Road, Caledon, Regional Municipality of Peel, Ontario, Canada, L0N",-80.0245072,43.8215894,-80.0299136,-80.0199562,43.8118395,43.8317397,1167
"Canada. Ontario. Grey County. Owen Sound. Wrights flour mill, a few hundred ft E of road,  about 1 mi W of Seldon Hotel.","Durham, West Grey, Grey County, Ontario, Canada, N0G 1R0",-80.8185006,44.1763254,-80.8524547,-80.7826143,44.1624531,44.1869224,3102
"Canada. Ontario. Simcoe County. Along road near top of Blue Mountain, 4 miles west-southwest of Simcoe County.","The Blue Mountains, Grey County, Ontario, Canada",-80.4616828,44.5458789,-80.515089,-80.2664899,44.3727654,44.5962451,16484
"USA, Missouri, Harrison County, Bethany, 4.5 mi S of Bethany","South Street, Bethany, Bethany Township, Harrison County, Missouri, United States, 64424",-94.0478207,40.2579293,-94.0586732,-94.036553,40.25649592,40.25919388,937
USA. Kansas. Wyandotte County. Edwardsville.,"Edwardsville, Wyandotte County, Kansas, United States, 66111",-94.8196847,39.0611154,-94.853615,-94.788164,39.0435141,39.105972,3528
"USA, Kansas, Linn County, La Cygne, 3 mi E of La Cygne","LaCygne, Lincoln Township, Linn County, Kansas, United States, 66040",-94.7613475,38.3500206,-94.7796249,-94.7427089,38.337686,38.35995,1967
"USA. Nebraska. Sarpy County. Meadow Station. Kiewitz Quarry, just west of Meadow Station.","Sarpy County, Nebraska, United States",-96.195132,41.0744042,-96.339805,-95.841611,40.9943079,41.1909909,15071
"USA. Kansas. Leavenworth County. Lenape. Union Pacific Quarry, 1 mile E of Lenape.","Lenape, Sherman Township, Leavenworth County, Kansas, United States, 66052",-94.9528213,38.9962152,-94.95417028,-94.95147232,38.99486622,38.99756418,190
USA. Nebraska. Cass County. Oreapolis. 2 mi W of Oreapolis.,"Oreapolis, Plattsmouth Precinct, Cass County, Nebraska, United States, 68048",-95.918344,41.047499,-95.91969298,-95.91699502,41.04615002,41.04884798,188
"USA. Missouri. Grundy County. Trenton. 1 mi W of Trenton. 701, MO20.1","Trenton, Trenton Township, Grundy County, Missouri, United States, 64683",-93.6166074,40.0789018,-93.6369371,-93.5608449,40.058796,40.119052,2827
"USA, Missouri, St. Louis County, Clayton, 25 mi W of courthouse, 300 ft S of Ladue Road.","Ladue Road, Clayton, St. Louis County, Missouri, United States",-90.3513445,38.6533637,-90.3535886,-90.3486452,38.65199307,38.65469103,248
USA. Kansas. Douglas County. Lecompton. 1.5 mi W of Lecompton.,"Lecompton, Lecompton Township, Douglas County, Kansas, United States, 66050",-95.3946967,39.0444449,-95.4050301,-95.38134,39.0149961,39.056382,1759
"USA, Missouri, Jackson County, SW of E 15th Street, E Kansas City.","East 15th Street, Downtown Kansas City, Kansas City, Kaw Township, Jackson County, Missouri, United States",-94.5758156,39.0956511,-94.5775967,-94.5740496,39.09430517,39.09700313,214
"USA, Kansas, Osage County, Melvern, railroad cut in the southern part of Melvern, highway cut about 1-2 miles north of Melvern.","Melvern Lake Parkway, Olivet Township, Osage County, Kansas, United States",-95.7048573,38.5004557,-95.711556,-95.6970823,38.4929834,38.508127,1015
"USA. Oklahoma. Wagoner County. Rex Bridge over Grand River, about 8-10 mi N of Muskogee.","Wagoner County, Oklahoma, United States",-95.5197394,35.9192397,-95.8194771,-95.2079181,35.76516,36.163011,32024
"USA. Nebraska, Sarpy County, Dyson Hollow, 1.13 miles W of La Platte.","Dyson Hollow Road, LaPlatte I Precinct, Sarpy County, Nebraska, United States, 68123",-95.9518967,41.0764855,-95.95421013,-95.95151217,41.0633263,41.0897518,1474
USA. Oklahoma. Pontotoc County. near Ada.,"Ada, Pontotoc County, Oklahoma, United States",-96.6783449,34.774531,-96.7574741,-96.5648481,34.505934,34.840111,12680
"USA, Nebraska, Lancaster County, 1 mi SE of Bennet","Bennet, Nemaha Precinct, Lancaster County, Nebraska, United States, 68317",-96.5066802,40.6826333,-96.5114771,-96.4923342,40.6748963,40.6880619,950
USA. Nebraska. Lancaster County. Bennet. 1.75 mi E of Bennet.,"Bennet, Nemaha Precinct, Lancaster County, Nebraska, United States, 68317",-96.5066802,40.6826333,-96.5114771,-96.4923342,40.6748963,40.6880619,950
USA. Oklahoma. Washington County. Dewey. Quarry east of Dewey.,"Dewey, Washington County, Oklahoma, United States",-95.9355387,36.7959193,-95.9489619,-95.917129,36.771517,36.8295149,2961
"USA, Nebraska, Cass County, Plattsmouth, zone B, roadside, 2 mi NW of Plattsmouth.","Plattsmouth, Plattsmouth Precinct, Cass County, Nebraska, United States, 68048",-95.8808424,41.0111103,-95.922217,-95.8681889,40.97695,41.0263049,1995
"USA, Nebraska, Cass County, Ashland, 2.5 mi S  4 mi E of Ashland","Cass County, Nebraska, United States",-96.1526985,40.8755529,-96.463861,-95.809379,40.78347,41.0660011,28169
USA. Nebraska. Cass County. Nehawka. Snyderville Quarry.,"Nehawka, Nehawka Precinct, Cass County, Nebraska, United States, 68413",-95.9915664,40.8303487,-95.997762,-95.9834449,40.824676,40.834061,800
"USA, Kansas, Douglas County, Eudora","Eudora, Eudora Township, Douglas County, Kansas, United States, 66025",-95.0985807,38.9433372,-95.1212179,-95.0702529,38.9096001,38.950778,2591
"USA, Nebraska, Cass County, Weeping Water, 1 mi W  1.5 mi N of Weeping Water","I Street, Weeping Water, Cass County, Nebraska, United States, 68463",-96.1424148,40.8699615,-96.1450769,-96.1400239,40.86860337,40.87130133,251
